id,kind,url,license,use,domain_weight,notes
unicode-cuneiform-block,unicode_metadata,https://www.unicode.org/charts/PDF/U12000.pdf,Unicode License reviewed for metadata use,scoring,0.45,Encoded sign metadata for infrastructure and font checks
cdli-catalog,epigraphic_corpus,https://cdli.mpiwg-berlin.mpg.de/,license and per-record reuse terms require review,scoring_only,0.8,Tablet catalog and transliteration evidence for scoring only
oracc-projects,epigraphic_corpus,http://oracc.museum.upenn.edu/,project-specific licenses require review,scoring_only,0.7,Structured editions and sign values for discovery and scoring only
epsd2,lexicon,http://oracc.museum.upenn.edu/epsd2/,license and attribution terms require review,discovery_only,0.55,Gloss and sign-value discovery only until derivative-use review
noto-sans-cuneiform,font_reference,https://fonts.google.com/noto/specimen/Noto+Sans+Cuneiform,SIL Open Font License,scoring,0.2,Rendering reference for encoded cuneiform signs
app-authored-cuneiform-examples,authored_examples,,app_owned,shipped_content,0.9,Reviewed sign-recognition examples authored by GlyphBridge
