id,kind,url,license,use,domain_weight,notes
unicode-tamil-block,unicode_metadata,https://www.unicode.org/charts/PDF/U0B80.pdf,Unicode License reviewed for metadata use,scoring,0.4,Tamil code point metadata for infrastructure use only
cldr-ta-exemplars,locale_metadata,https://cldr.unicode.org/,Unicode License reviewed for metadata use,scoring,0.5,Tamil exemplar characters and locale behavior; confirm exact CLDR release before ingestion
wordfreq-ta,frequency,https://github.com/rspeer/wordfreq,MIT package license; upstream corpus licenses require review,scoring_only,0.55,Broad frequency intuition only; do not ship derived upstream example text
tamil-wiktionary,lexicon,https://ta.wiktionary.org/,CC BY-SA; attribution and share-alike review required,discovery_only,0.45,Gloss and spelling discovery only until attribution implications are approved
openstreetmap-tamil-names,environmental_print,https://www.openstreetmap.org/,ODbL; derived-data obligations require review,scoring_only,0.75,Transit place-name and facility-sign validation; do not ship raw extracts without review
indic-nlp-library-ta,segmentation_tooling,https://github.com/anoopkunchukuttan/indic_nlp_library,MIT package license; bundled resources require review,scoring_only,0.45,Tokenizer and normalization analysis only until behavior is reviewed
app-authored-tamil-domain-examples,authored_examples,,app_owned,shipped_content,0.9,Short reviewed examples authored by GlyphBridge rather than copied from third-party corpora
