id,kind,url,license,use,domain_weight,notes
unicode-cyrillic-block,unicode_metadata,https://www.unicode.org/charts/PDF/U0400.pdf,Unicode License reviewed for metadata use,scoring,0.4,Cyrillic code points and case metadata for infrastructure use
cldr-ru-exemplars,locale_metadata,https://cldr.unicode.org/,Unicode License reviewed for metadata use,scoring,0.5,Russian exemplar characters and collation data
wordfreq-ru,frequency,https://github.com/rspeer/wordfreq,MIT package license; upstream corpus licenses require review,scoring_only,0.55,Broad Russian frequency intuition; do not ship derived corpus examples
russian-wiktionary,lexicon,https://ru.wiktionary.org/,CC BY-SA; attribution and share-alike review required,discovery_only,0.45,Gloss and stress discovery only until attribution obligations are approved
openstreetmap-russia-names,environmental_print,https://www.openstreetmap.org/,ODbL; derived-data obligations require review,scoring_only,0.8,Street transit and place-name validation; do not ship raw extracts without review
app-authored-russian-examples,authored_examples,,app_owned,shipped_content,0.95,Short reviewed examples authored by Glyphin
