id,kind,url,license,use,domain_weight,notes
unicode-meetei-mayek-block,unicode_metadata,https://www.unicode.org/charts/PDF/UABC0.pdf,Unicode License reviewed for metadata use,scoring,0.45,Meitei Mayek code point and final-letter metadata for infrastructure use only
cldr-mni-mtei-exemplars,locale_metadata,https://cldr.unicode.org/,Unicode License reviewed for metadata use,scoring,0.45,Manipuri Meitei Mayek locale metadata where available; confirm exact CLDR release before ingestion
wiktionary-manipuri-discovery,lexicon,https://en.wiktionary.org/,CC BY-SA; attribution and share-alike review required,discovery_only,0.35,Spelling and gloss discovery only until share-alike obligations are approved
meitei-mayek-learning-references,orthography_reference,,publisher or site licenses require review,discovery_only,0.35,Use only to plan specialist review around vowel signs and final letters
openstreetmap-meitei-names,environmental_print,https://www.openstreetmap.org/,ODbL; derived-data obligations require review,scoring_only,0.55,Place and public-label validation only; do not ship raw extracts
app-authored-meitei-domain-examples,authored_examples,,app_owned,shipped_content,0.9,Short reviewed examples authored by GlyphBridge rather than copied from third-party corpora
