id,kind,url,license,use,domain_weight,notes
unicode-gurmukhi-block,unicode_metadata,https://www.unicode.org/charts/PDF/U0A00.pdf,Unicode License reviewed for metadata use,scoring,0.4,Gurmukhi metadata for letters signs addak halant nukta and digits
cldr-pa-guru-exemplars,locale_metadata,https://cldr.unicode.org/,Unicode License reviewed for metadata use,scoring,0.5,Punjabi Gurmukhi exemplar characters and locale behavior
wordfreq-pa,frequency,https://github.com/rspeer/wordfreq,MIT package license; upstream corpus licenses require review,scoring_only,0.5,Broad Punjabi frequency intuition only
indic-nlp-library-pa,tokenizer_transliteration_tool,https://github.com/anoopkunchukuttan/indic_nlp_library,MIT package license reviewed for tooling use,discovery_only,0.1,Normalization and transliteration tooling only
dakshina-pa,transliteration_pronunciation_dataset,https://github.com/google-research-datasets/dakshina,CC BY-SA 4.0; attribution and share-alike review required,discovery_only,0.3,Romanization and pronunciation discovery only
pa-wiktionary,lexicon,https://pa.wiktionary.org/,CC BY-SA; attribution and share-alike review required,discovery_only,0.4,Gloss and spelling discovery only
openstreetmap-punjab-names,environmental_print,https://www.openstreetmap.org/,ODbL; derived-data obligations require review,scoring_only,0.75,Place transit and public-signage validation only
app-authored-punjabi-domain-examples,authored_examples,,app_owned,shipped_content,0.95,Reviewed examples authored by Glyphin
